{
  "$schema": "https://json-schema.org/draft/2020-12/schema",
  "$id": "https://raw.githubusercontent.com/erickdronski/contexttest/main/schema/contexttest.schema.json",
  "title": "ContextTest configuration",
  "type": "object",
  "additionalProperties": false,
  "required": ["version", "project", "agent", "variants", "tasks"],
  "properties": {
    "$schema": { "type": "string" },
    "version": { "const": 1 },
    "project": { "type": "string", "minLength": 1 },
    "baseRef": { "type": "string", "default": "HEAD" },
    "instructionFile": { "type": "string", "default": "AGENTS.md" },
    "agent": { "$ref": "#/$defs/agent", "required": ["provider"] },
    "trials": {
      "type": "object",
      "additionalProperties": false,
      "properties": {
        "attempts": { "type": "integer", "minimum": 1, "maximum": 50, "default": 3 },
        "concurrency": { "type": "integer", "minimum": 1, "maximum": 8, "default": 1 }
      }
    },
    "setup": {
      "type": "object",
      "additionalProperties": false,
      "required": ["commands"],
      "properties": {
        "commands": {
          "type": "array",
          "items": { "type": "array", "minItems": 1, "prefixItems": [{ "type": "string", "minLength": 1 }], "items": { "type": "string" } }
        },
        "timeoutMinutes": { "type": "number", "exclusiveMinimum": 0, "maximum": 1440, "default": 10 }
      }
    },
    "environment": {
      "type": "object",
      "additionalProperties": false,
      "properties": {
        "inherit": { "type": "boolean", "default": false },
        "allow": { "type": "array", "items": { "type": "string" } },
        "deny": { "type": "array", "items": { "type": "string" } },
        "set": { "type": "object", "additionalProperties": { "type": ["string", "number", "boolean"] } }
      }
    },
    "variants": {
      "type": "array",
      "minItems": 2,
      "maxItems": 2,
      "items": {
        "type": "object",
        "additionalProperties": false,
        "required": ["name"],
        "properties": {
          "name": { "type": "string", "minLength": 1 },
          "disabled": { "const": true },
          "source": { "type": "string", "minLength": 1 },
          "content": { "type": "string" },
          "agent": { "$ref": "#/$defs/agent", "description": "Overrides the top-level agent for this variant. Naming a different provider replaces the agent; otherwise fields are merged." }
        },
        "oneOf": [
          { "required": ["disabled"] },
          { "required": ["source"] },
          { "required": ["content"] }
        ]
      }
    },
    "tasks": {
      "type": "array",
      "minItems": 1,
      "items": {
        "type": "object",
        "additionalProperties": true,
        "required": ["name", "prompt"],
        "properties": {
          "name": { "type": "string", "minLength": 1 },
          "prompt": { "type": "string", "minLength": 1 },
          "ref": { "type": "string" },
          "mock": {
            "type": "object",
            "additionalProperties": false,
            "required": ["command"],
            "properties": { "command": { "type": "array", "minItems": 1, "prefixItems": [{ "type": "string", "minLength": 1 }], "items": { "type": "string" } } }
          },
          "assertions": { "type": "array", "items": { "$ref": "#/$defs/assertion" } }
        }
      }
    }
  },
  "$defs": {
    "agent": {
      "type": "object",
      "additionalProperties": true,
      "properties": {
        "provider": { "enum": ["codex", "claude", "command", "mock"] },
        "model": { "type": "string" },
        "executable": { "type": "string" },
        "command": { "type": "array", "minItems": 1, "prefixItems": [{ "type": "string", "minLength": 1 }], "items": { "type": "string" } },
        "timeoutMinutes": { "type": "number", "exclusiveMinimum": 0, "maximum": 1440 },
        "maxTurns": { "type": "integer", "minimum": 1, "maximum": 1000 },
        "permissionMode": { "enum": ["default", "acceptEdits", "plan", "bypassPermissions"] },
        "allowedTools": { "type": "array", "items": { "type": "string" } },
        "disallowedTools": { "type": "array", "items": { "type": "string" } },
        "ignoreUserConfig": { "type": "boolean" },
        "isolate": { "type": "boolean", "description": "Keep the experimenter's user-level agent setup out of trials. Claude Code: --strict-mcp-config --setting-sources project,local. Codex: --ignore-user-config." }
      }
    },
    "assertion": {
      "type": "object",
      "additionalProperties": false,
      "required": ["type"],
      "properties": {
        "type": { "enum": ["command", "maxChangedFiles", "minChangedFiles", "maxDiffLines", "allowedPaths", "forbiddenPaths", "requiredFile", "forbiddenFile", "fileContains", "stdoutContains", "stdoutNotContains"] },
        "label": { "type": "string", "minLength": 1 },
        "value": {}, "path": { "type": "string", "minLength": 1 }, "patterns": { "type": "array", "minItems": 1, "items": { "type": "string", "minLength": 1 } },
        "command": { "type": "array", "minItems": 1, "prefixItems": [{ "type": "string", "minLength": 1 }], "items": { "type": "string" } },
        "exitCode": { "type": "integer" }, "timeoutMinutes": { "type": "number", "exclusiveMinimum": 0, "maximum": 1440 }
      },
      "allOf": [
        { "if": { "properties": { "type": { "const": "command" } } }, "then": { "required": ["command"] } },
        { "if": { "properties": { "type": { "enum": ["maxChangedFiles", "minChangedFiles", "maxDiffLines"] } } }, "then": { "required": ["value"], "properties": { "value": { "type": "integer", "minimum": 0 } } } },
        { "if": { "properties": { "type": { "enum": ["allowedPaths", "forbiddenPaths"] } } }, "then": { "required": ["patterns"] } },
        { "if": { "properties": { "type": { "enum": ["requiredFile", "forbiddenFile"] } } }, "then": { "required": ["path"] } },
        { "if": { "properties": { "type": { "const": "fileContains" } } }, "then": { "required": ["path", "value"], "properties": { "value": { "type": "string", "minLength": 1 } } } },
        { "if": { "properties": { "type": { "enum": ["stdoutContains", "stdoutNotContains"] } } }, "then": { "required": ["value"], "properties": { "value": { "type": "string", "minLength": 1 } } } }
      ]
    }
  }
}
